<?xml version="1.0" encoding="UTF-8"?>
<dataroot xmlns:od="urn:schemas-microsoft-com:officedata" xmlns:xsi="http://www.w3.org/2001/XMLSchema-instance"  xsi:noNamespaceSchemaLocation="Актёры.xsd" generated="2016-03-14T21:06:25">
<Актёры>
<ID_Актёра>1</ID_Актёра>
<Табельный_номер>0</Табельный_номер>
<Имя>Николай</Имя>
<Фамилия>Стуликов</Фамилия>
</Актёры>
<Актёры>
<ID_Актёра>2</ID_Актёра>
<Табельный_номер>101</Табельный_номер>
<Имя>Александр</Имя>
<Фамилия>Лекер</Фамилия>
</Актёры>
<Актёры>
<ID_Актёра>3</ID_Актёра>
<Табельный_номер>125</Табельный_номер>
<Имя>Андрей</Имя>
<Фамилия>Ким</Фамилия>
</Актёры>
<Актёры>
<ID_Актёра>4</ID_Актёра>
<Табельный_номер>190</Табельный_номер>
<Имя>Леонид</Имя>
<Фамилия>Заболовский</Фамилия>
</Актёры>
<Актёры>
<ID_Актёра>5</ID_Актёра>
<Табельный_номер>227</Табельный_номер>
<Имя>Радмир</Имя>
<Фамилия>Габдрахманов</Фамилия>
</Актёры>
<Актёры>
<ID_Актёра>6</ID_Актёра>
<Табельный_номер>234</Табельный_номер>
<Имя>Алексей</Имя>
<Фамилия>Менделев</Фамилия>
</Актёры>
<Актёры>
<ID_Актёра>7</ID_Актёра>
<Табельный_номер>239</Табельный_номер>
<Имя>Ольга</Имя>
<Фамилия>Зворыгина</Фамилия>
</Актёры>
<Актёры>
<ID_Актёра>8</ID_Актёра>
<Табельный_номер>242</Табельный_номер>
<Имя>Алексей</Имя>
<Фамилия>Ворожцов</Фамилия>
</Актёры>
<Актёры>
<ID_Актёра>9</ID_Актёра>
<Табельный_номер>243</Табельный_номер>
<Имя>Ирина</Имя>
<Фамилия>Иванова</Фамилия>
</Актёры>
<Актёры>
<ID_Актёра>10</ID_Актёра>
<Табельный_номер>259</Табельный_номер>
<Имя>Евгений</Имя>
<Фамилия>Высотин</Фамилия>
</Актёры>
<Актёры>
<ID_Актёра>11</ID_Актёра>
<Табельный_номер>274</Табельный_номер>
<Имя>Ульяна</Имя>
<Фамилия>Павлова</Фамилия>
</Актёры>
<Актёры>
<ID_Актёра>12</ID_Актёра>
<Табельный_номер>278</Табельный_номер>
<Имя>Александр</Имя>
<Фамилия>Шарапов</Фамилия>
</Актёры>
<Актёры>
<ID_Актёра>13</ID_Актёра>
<Табельный_номер>283</Табельный_номер>
<Имя>Ксения</Имя>
<Фамилия>Корнева</Фамилия>
</Актёры>
<Актёры>
<ID_Актёра>14</ID_Актёра>
<Табельный_номер>284</Табельный_номер>
<Имя>Владимир</Имя>
<Фамилия>Потеряхин</Фамилия>
</Актёры>
<Актёры>
<ID_Актёра>15</ID_Актёра>
<Табельный_номер>296</Табельный_номер>
<Имя>Михаил</Имя>
<Фамилия>Васильев</Фамилия>
</Актёры>
<Актёры>
<ID_Актёра>16</ID_Актёра>
<Табельный_номер>299</Табельный_номер>
<Имя>Григорий</Имя>
<Фамилия>Ким</Фамилия>
</Актёры>
<Актёры>
<ID_Актёра>17</ID_Актёра>
<Табельный_номер>300</Табельный_номер>
<Имя>Александр</Имя>
<Фамилия>Николаев</Фамилия>
</Актёры>
<Актёры>
<ID_Актёра>18</ID_Актёра>
<Табельный_номер>301</Табельный_номер>
<Имя>Вероника</Имя>
<Фамилия>Потапова</Фамилия>
</Актёры>
<Актёры>
<ID_Актёра>19</ID_Актёра>
<Табельный_номер>305</Табельный_номер>
<Имя>Андрей</Имя>
<Фамилия>Койнов</Фамилия>
</Актёры>
<Актёры>
<ID_Актёра>20</ID_Актёра>
<Табельный_номер>307</Табельный_номер>
<Имя>Анастасия</Имя>
<Фамилия>Маркова</Фамилия>
</Актёры>
<Актёры>
<ID_Актёра>21</ID_Актёра>
<Табельный_номер>308</Табельный_номер>
<Имя>Анна</Имя>
<Фамилия>Суслова</Фамилия>
</Актёры>
<Актёры>
<ID_Актёра>22</ID_Актёра>
<Табельный_номер>310</Табельный_номер>
<Имя>Дарья</Имя>
<Фамилия>Худалеева</Фамилия>
</Актёры>
<Актёры>
<ID_Актёра>23</ID_Актёра>
<Табельный_номер>314</Табельный_номер>
<Имя>Елена</Имя>
<Фамилия>Воробьёва</Фамилия>
</Актёры>
<Актёры>
<ID_Актёра>24</ID_Актёра>
<Табельный_номер>321</Табельный_номер>
<Имя>Анастасия</Имя>
<Фамилия>Родзевич</Фамилия>
</Актёры>
<Актёры>
<ID_Актёра>25</ID_Актёра>
<Табельный_номер>324</Табельный_номер>
<Имя>Марина</Имя>
<Фамилия>Цой</Фамилия>
</Актёры>
<Актёры>
<ID_Актёра>26</ID_Актёра>
<Табельный_номер>1101</Табельный_номер>
<Имя>Иван</Имя>
<Фамилия>Устинов</Фамилия>
</Актёры>
<Актёры>
<ID_Актёра>27</ID_Актёра>
<Табельный_номер>285</Табельный_номер>
<Имя>Антон</Имя>
<Фамилия>Данилов</Фамилия>
</Актёры>
<Актёры>
<ID_Актёра>28</ID_Актёра>
<Табельный_номер>292</Табельный_номер>
<Имя>Павел</Имя>
<Фамилия>Рыхлов</Фамилия>
</Актёры>
<Актёры>
<ID_Актёра>29</ID_Актёра>
<Табельный_номер>287</Табельный_номер>
<Имя>Вадим</Имя>
<Фамилия>Романов</Фамилия>
</Актёры>
<Актёры>
<ID_Актёра>30</ID_Актёра>
<Табельный_номер>282</Табельный_номер>
<Имя>Михаил</Имя>
<Фамилия>Кононов</Фамилия>
</Актёры>
<Актёры>
<ID_Актёра>31</ID_Актёра>
<Табельный_номер>288</Табельный_номер>
<Имя>Оксана</Имя>
<Фамилия>Сосновских</Фамилия>
</Актёры>
<Актёры>
<ID_Актёра>32</ID_Актёра>
<Табельный_номер>280</Табельный_номер>
<Имя>Ольга</Имя>
<Фамилия>Есаулкова</Фамилия>
</Актёры>
<Актёры>
<ID_Актёра>33</ID_Актёра>
<Табельный_номер>289</Табельный_номер>
<Имя>Анна</Имя>
<Фамилия>Тюрина</Фамилия>
</Актёры>
<Актёры>
<ID_Актёра>34</ID_Актёра>
<Табельный_номер>267</Табельный_номер>
<Имя>Евгения</Имя>
<Фамилия>Хоменко</Фамилия>
</Актёры>
<Актёры>
<ID_Актёра>35</ID_Актёра>
<Табельный_номер>290</Табельный_номер>
<Имя>Юлия</Имя>
<Фамилия>Кожевникова</Фамилия>
</Актёры>
<Актёры>
<ID_Актёра>36</ID_Актёра>
<Табельный_номер>257</Табельный_номер>
<Имя>Вера</Имя>
<Фамилия>Чернова</Фамилия>
</Актёры>
<Актёры>
<ID_Актёра>37</ID_Актёра>
<Табельный_номер>162</Табельный_номер>
<Имя>Дмитрий</Имя>
<Фамилия>Гусельников</Фамилия>
</Актёры>
<Актёры>
<ID_Актёра>38</ID_Актёра>
<Табельный_номер>213</Табельный_номер>
<Имя>Павел</Имя>
<Фамилия>Тихонов</Фамилия>
</Актёры>
<Актёры>
<ID_Актёра>39</ID_Актёра>
<Табельный_номер>175</Табельный_номер>
<Имя>Антон</Имя>
<Фамилия>Бобров</Фамилия>
</Актёры>
<Актёры>
<ID_Актёра>40</ID_Актёра>
<Табельный_номер>200</Табельный_номер>
<Имя>Олег</Имя>
<Фамилия>Константинов</Фамилия>
</Актёры>
<Актёры>
<ID_Актёра>41</ID_Актёра>
<Табельный_номер>161</Табельный_номер>
<Имя>Кирилл</Имя>
<Фамилия>Козлов</Фамилия>
</Актёры>
<Актёры>
<ID_Актёра>42</ID_Актёра>
<Табельный_номер>204</Табельный_номер>
<Имя>Наталья</Имя>
<Фамилия>Генина</Фамилия>
</Актёры>
<Актёры>
<ID_Актёра>43</ID_Актёра>
<Табельный_номер>186</Табельный_номер>
<Имя>Наталья</Имя>
<Фамилия>Сивушенко</Фамилия>
</Актёры>
<Актёры>
<ID_Актёра>44</ID_Актёра>
<Табельный_номер>147</Табельный_номер>
<Имя>Наталья</Имя>
<Фамилия>Майер</Фамилия>
</Актёры>
<Актёры>
<ID_Актёра>45</ID_Актёра>
<Табельный_номер>215</Табельный_номер>
<Имя>Александр</Имя>
<Фамилия>Гармс</Фамилия>
</Актёры>
<Актёры>
<ID_Актёра>46</ID_Актёра>
<Табельный_номер>206</Табельный_номер>
<Имя>Елена</Имя>
<Фамилия>Мельцер</Фамилия>
</Актёры>
<Актёры>
<ID_Актёра>47</ID_Актёра>
<Табельный_номер>208</Табельный_номер>
<Имя>Александра</Имя>
<Фамилия>Чижова</Фамилия>
</Актёры>
<Актёры>
<ID_Актёра>48</ID_Актёра>
<Табельный_номер>225</Табельный_номер>
<Имя>Сергей</Имя>
<Фамилия>Кротов</Фамилия>
</Актёры>
<Актёры>
<ID_Актёра>49</ID_Актёра>
<Табельный_номер>220</Табельный_номер>
<Имя>Мария</Имя>
<Фамилия>Милова</Фамилия>
</Актёры>
<Актёры>
<ID_Актёра>50</ID_Актёра>
<Табельный_номер>217</Табельный_номер>
<Имя>Юлия</Имя>
<Фамилия>Киселёва</Фамилия>
</Актёры>
<Актёры>
<ID_Актёра>51</ID_Актёра>
<Табельный_номер>219</Табельный_номер>
<Имя>Светлана</Имя>
<Фамилия>Воронова</Фамилия>
</Актёры>
<Актёры>
<ID_Актёра>52</ID_Актёра>
<Табельный_номер>272</Табельный_номер>
<Имя>Дина</Имя>
<Фамилия>Искандарова</Фамилия>
</Актёры>
<Актёры>
<ID_Актёра>53</ID_Актёра>
<Табельный_номер>276</Табельный_номер>
<Имя>Елена</Имя>
<Фамилия>Туркина</Фамилия>
</Актёры>
<Актёры>
<ID_Актёра>54</ID_Актёра>
<Табельный_номер>152</Табельный_номер>
<Имя>Екатерина</Имя>
<Фамилия>Симонова</Фамилия>
</Актёры>
<Актёры>
<ID_Актёра>55</ID_Актёра>
<Табельный_номер>298</Табельный_номер>
<Имя>Андрей</Имя>
<Фамилия>Канашов</Фамилия>
</Актёры>
<Актёры>
<ID_Актёра>56</ID_Актёра>
<Табельный_номер>295</Табельный_номер>
<Имя>Людмила</Имя>
<Фамилия>Бородина</Фамилия>
</Актёры>
<Актёры>
<ID_Актёра>57</ID_Актёра>
<Табельный_номер>249</Табельный_номер>
<Имя>Тимур</Имя>
<Фамилия>Груздев</Фамилия>
</Актёры>
<Актёры>
<ID_Актёра>59</ID_Актёра>
<Табельный_номер>248</Табельный_номер>
<Имя>Ирина</Имя>
<Фамилия>Теплова</Фамилия>
</Актёры>
<Актёры>
<ID_Актёра>60</ID_Актёра>
<Табельный_номер>251</Табельный_номер>
<Имя>Марина</Имя>
<Фамилия>Пушкарёва</Фамилия>
</Актёры>
<Актёры>
<ID_Актёра>62</ID_Актёра>
<Табельный_номер>218</Табельный_номер>
<Имя>Анна</Имя>
<Фамилия>Попкова</Фамилия>
</Актёры>
<Актёры>
<ID_Актёра>63</ID_Актёра>
<Табельный_номер>1</Табельный_номер>
<Имя>Александр</Имя>
<Фамилия>Жовнер</Фамилия>
</Актёры>
<Актёры>
<ID_Актёра>65</ID_Актёра>
<Табельный_номер>2</Табельный_номер>
<Имя>Сергей</Имя>
<Фамилия>Плотников</Фамилия>
</Актёры>
<Актёры>
<ID_Актёра>66</ID_Актёра>
<Табельный_номер>3</Табельный_номер>
<Имя>Флора</Имя>
<Фамилия>Перевалова</Фамилия>
</Актёры>
<Актёры>
<ID_Актёра>67</ID_Актёра>
<Табельный_номер>4</Табельный_номер>
<Имя>Борис</Имя>
<Фамилия>Фельдман</Фамилия>
</Актёры>
<Актёры>
<ID_Актёра>68</ID_Актёра>
<Табельный_номер>5</Табельный_номер>
<Имя>Вадим</Имя>
<Фамилия>Ладыгин</Фамилия>
</Актёры>
<Актёры>
<ID_Актёра>69</ID_Актёра>
<Табельный_номер>6</Табельный_номер>
<Имя>Владимир</Имя>
<Фамилия>Глазков</Фамилия>
</Актёры>
<Актёры>
<ID_Актёра>70</ID_Актёра>
<Табельный_номер>7</Табельный_номер>
<Имя>Леонид</Имя>
<Фамилия>Садовский</Фамилия>
</Актёры>
<Актёры>
<ID_Актёра>71</ID_Актёра>
<Табельный_номер>8</Табельный_номер>
<Имя>Владимир</Имя>
<Фамилия>Невьянцев</Фамилия>
</Актёры>
<Актёры>
<ID_Актёра>72</ID_Актёра>
<Табельный_номер>9</Табельный_номер>
<Имя>Елена</Имя>
<Фамилия>Андросенко</Фамилия>
</Актёры>
<Актёры>
<ID_Актёра>73</ID_Актёра>
<Табельный_номер>10</Табельный_номер>
<Имя>Татьяна</Имя>
<Фамилия>Кривоногова</Фамилия>
</Актёры>
<Актёры>
<ID_Актёра>74</ID_Актёра>
<Табельный_номер>11</Табельный_номер>
<Имя>Татьяна</Имя>
<Фамилия>Зайцева</Фамилия>
</Актёры>
<Актёры>
<ID_Актёра>75</ID_Актёра>
<Табельный_номер>12</Табельный_номер>
<Имя>Леонид</Имя>
<Фамилия>Архипов</Фамилия>
</Актёры>
<Актёры>
<ID_Актёра>76</ID_Актёра>
<Табельный_номер>13</Табельный_номер>
<Имя>Александр</Имя>
<Фамилия>Шаров</Фамилия>
</Актёры>
<Актёры>
<ID_Актёра>77</ID_Актёра>
<Табельный_номер>14</Табельный_номер>
<Имя>Борис</Имя>
<Фамилия>Шварцман</Фамилия>
</Актёры>
<Актёры>
<ID_Актёра>78</ID_Актёра>
<Табельный_номер>15</Табельный_номер>
<Имя>Юрий</Имя>
<Фамилия>Степанов</Фамилия>
</Актёры>
<Актёры>
<ID_Актёра>79</ID_Актёра>
<Табельный_номер>16</Табельный_номер>